{
  "format": "org.deccanbirders.journal",
  "formatVersion": "1.0.0",
  "owner": "1234567890abcdef1234567890abcdef12345678",
  "feedTopic": "org.deccanbirders.sighting/journal/v1",
  "sequence": 1,
  "previous": "5f1e2d3c4b5a69788796a5b4c3d2e1f00f1e2d3c4b5a69788796a5b4c3d2e1f0",
  "updatedAt": "2026-09-14T02:05:40Z",
  "entries": [
    { "ref": "0b8f3a2c1d4e5f60718293a4b5c6d7e8f9a0b1c2d3e4f5061728394a5b6c7d8e", "id": "3f6c2a9e-8b1d-4c7e-9a2f-5d0e1b7c4a61", "commonName": "Indian Robin", "observedOn": "2026-09-14", "hasPhoto": true, "addedAt": "2026-09-14T02:05:40Z" },
    { "ref": "1c9a4b3d2e5f60718293a4b5c6d7e8f90a1b2c3d4e5f60718293a4b5c6d7e8f9", "id": "9d8e7f60-1a2b-4c3d-8e4f-50617283a4b5", "commonName": "Great Indian Bustard", "observedOn": "1998-01-11", "hasPhoto": false, "addedAt": "2026-09-13T11:20:00Z" }
  ]
}
